question_text;question_image;question_category
Stav, keï sú ivotné deje obmedzené na minimum sa nazıva;;TO BE UPDATED
Môu sa bunky v niektorıch druhoch kolónií špecializova na urèité funkcie;;TO BE UPDATED
Reprodukèná izolácia druhu znamená, e;;TO BE UPDATED
Vıznam vody v organizme;;TO BE UPDATED
Akú špecifickos enzımov rozoznávame;;TO BE UPDATED
Èo je podstatné pre vegetatívne rozmnoovanie z h¾adiska dediènosti;;TO BE UPDATED
Gonochorizmus je;;TO BE UPDATED
Prispôsobivos organizmu k podmienkam vonkajšieho prostredia sa nazıva;;TO BE UPDATED
Inhibítory enzımov;;TO BE UPDATED
Je vybavenie bunky enzımami riadené geneticky;;TO BE UPDATED
V èom spoèíva substrátová špecifickos enzımov;;TO BE UPDATED
Ako sa nazıva kovalentná väzba v ATP, ktorá obsahuje ve¾ké mnostvo energie a ¾ahko sa štiepi;;TO BE UPDATED
Osmotická lıza bunky nastáva v prostredí;;TO BE UPDATED
Èo je základom pohlavného rozmnoovania mnohobunkovıch organizmov;;TO BE UPDATED
Zárodky všetkıch mnohobunkovıch ivoèíchov prejdú v individuálnom vıvine;;
Pri ktorom z dvoch hlavnıch spôsobov rozmnoovania mnohobunkovıch organizmov je vzniknutı jedinec z genetického h¾adiska identickı s rodièovskım organizmom;;TO BE UPDATED
Aminokyseliny v molekule bielkovín sa spájajú väzbou:;;TO BE UPDATED
Konjugácia sa vyskytuje u;;TO BE UPDATED
Pohlavnı dimorfizmus je;;TO BE UPDATED
Medzi aplikované biologické vedy patri;;TO BE UPDATED
K modelovım organizmom, ktoré sa pouívajú v biologickıch pokusoch patria;;TO BE UPDATED
Inbreeding je;;TO BE UPDATED
Energia, uvo¾nená pri chemickıch procesoch, sa viae do chemickıch väzieb v zlúèenine, ktorú nazıvame;;TO BE UPDATED
Energetickı metabolizmus mono charakterizova ako;;TO BE UPDATED
Vedecké zákony sú;;TO BE UPDATED
Anaeróbna glykolıza je chemickı proces, ktorı prebieha;;TO BE UPDATED
Èo sú enzımy;;TO BE UPDATED
Ktoré je posledné štádium vıvoja indivídua;;TO BE UPDATED
Medicína patrí medzi vedy;;TO BE UPDATED
Katabolizmus je;;TO BE UPDATED
Do akıch vyšších celkov sa zoskupujú rozlièné tkanivá;;TO BE UPDATED
Z h¾adiska zloitosti jednotlivca organizmy delíme na;;TO BE UPDATED
Keï' sa rozštiepi jedna makroenergická väzba, uvo¾ní sa energia pribline;;TO BE UPDATED
Epitely majú funkciu;;TO BE UPDATED
Medzi vedy o vıvoji patri;;TO BE UPDATED
V èom spoèíva funkèná špecifickos enzımov;;TO BE UPDATED
Fertilizácia je;;TO BE UPDATED
Medzi vedy o vıvoji nepatri;;TO BE UPDATED
Bunky podobnej štruktúry a funkcie sa zoskupujú do vyšších celkov, ktoré sa nazıvajú;;TO BE UPDATED
Aké rastlinné pletivá rozlišujeme pod¾a zhrubnutia bunkovej steny;;TO BE UPDATED
Èím je daná substrátová špecifickos enzımu;;TO BE UPDATED
Individuálny vıvin kadého mnohobunkového ivoèícha s pohlavnım rozmnoovaním má etapu;;TO BE UPDATED
Vıvoj jedinca z neoplodneného vajíèka sa volá;;TO BE UPDATED
Anabolizmus je;;TO BE UPDATED
Regulácia v bunke je ovplyvnená;;TO BE UPDATED
Hermafroditizmus je;;TO BE UPDATED
Anatómia patri medzi vedy;;TO BE UPDATED
Prapohlavné bunky, z ktorıch vznikajú gaméty sú;;TO BE UPDATED
K vıznamnım predstavite¾om biológie patri;;TO BE UPDATED
Regulácie vo vyšších mnohobunkovıch organizmoch prebiehajú pod kontrolou;;TO BE UPDATED
Základné spôsoby rozmnoovania u mnohobunkovıch organizmov sú;;TO BE UPDATED
Èo obsahuje molekula ATP;;TO BE UPDATED
Ako sa oznaèuje proces, pri ktorom sa z jednoduchıch látok tvoria nové, telu vlastné zloité látky;;TO BE UPDATED
Ktoré polysacharidy majú stavebnú funkciu;;TO BE UPDATED
Spôsob riadenia, spoloènı pre všetky mnohobunkové organizmy je;;TO BE UPDATED
Látková regulácia je v porovnaní s nervovou reguláciou;;TO BE UPDATED
Diferenciácia je;;TO BE UPDATED
Medzi fyziologické vedy patri;;TO BE UPDATED
Mikrobiológia patrí medzi vedy;;TO BE UPDATED
Medzi samostatné biologické vedy patri;;TO BE UPDATED
Samèie pohlavné bunky u mnohobunkovıch organizmov sa nazıvajú;;TO BE UPDATED
Samièie gaméty èloveka sú;;TO BE UPDATED
Model priestorovej DNA vypracovali;;TO BE UPDATED
O makromolekulárnych organickıch latkách ivıch organizmov platí, e;;TO BE UPDATED
O mikrobiológii platí, e;;TO BE UPDATED
Hierarchické usporiadanie pod¾a zloitosti - od najjednoduchšieho po najzloitejšie, v organizme èloveka je;;TO BE UPDATED
Typy epitelov sú;;TO BE UPDATED
Metódy bádania pouívané v biologickıch vedách sú;;TO BE UPDATED
Všeobecné vlastnosti ivıch organizmov sú;;TO BE UPDATED
Voda;;TO BE UPDATED
Medzi aplikované biologické vedy nepatri;;TO BE UPDATED
Biotickımi faktormi prostredia sú;;TO BE UPDATED
Z disacharidov sa v bunkách vyskytuje;;TO BE UPDATED
Bionika patrí medzi vedy;;TO BE UPDATED
O regulaènıch mechanizmoch mnohobunkovıch organizmov platí, e;;TO BE UPDATED
Ktoré polysacharidy majú zásobnú funkciu;;TO BE UPDATED
Medzi samostatné biologické vedy nepatrí;;TO BE UPDATED
Biológia;;TO BE UPDATED
Abiotickımi faktormi prostredia sú;;TO BE UPDATED
Bielkoviny;;TO BE UPDATED
Priemerné zastúpenie najdôleitejších zlúèenín v ivıch organizmoch je;;TO BE UPDATED
Akı je vıznam bielkovín;;TO BE UPDATED
Charakteristiky, ktoré definujú organizmus ako jedinca sú;;TO BE UPDATED
Histológia;;TO BE UPDATED
Virológia je;;TO BE UPDATED
K vıznamnım vedcom, ktorí ili v 18.storoèí patrí;;TO BE UPDATED
Bakteriológia;;TO BE UPDATED
Traubeho mechúrik je;;TO BE UPDATED
Fyziológia sa zaoberá;;TO BE UPDATED
Transportné proteíny plazmatickej membrány sú;;TO BE UPDATED
Na povrchu buniek sa môe nachádza;;TO BE UPDATED
Jadro prokaryotickıch buniek;;TO BE UPDATED
Telová bunka èloveka má za normálnych okolností;;TO BE UPDATED
Bunkové delenie sa zastaví;;TO BE UPDATED
Pre G1 fázu bunkového cyklu je charakteristické;;TO BE UPDATED
Èo sú aktivátory enzımov;;TO BE UPDATED
Èo patrí k membránovej sústave eukaryotickıch buniek;;TO BE UPDATED
Biomembrány sa skladajú z;;TO BE UPDATED
V metafáze mitózy sa chromozómy;;TO BE UPDATED
Z ko¾kıch biomembrán sú tvorené mitochondrie;;TO BE UPDATED
Medzi organely eukaryotickıch buniek patrí;;
Akı tvar majú mimojadrové chromozómy eukaryotickıch buniek;;
Nepriame delenie eukaryotickej bunky sa nazıva;;
Rıchlos difúzie závisí od;;
Priebeh bunkového cyklu a jeho reguláciu mono dobre sledova na bunkách pestovanıch mimo organizmu;;
Lyzozómy;;
Medzi fázy mitotického delenia v eukaryotickıch bunkách patrí;;
V ktorej fáze mitózy sa chromozómy skracujú a hrubnú;;
Ako sa nazıvajú bunky s jednou chromozómovou sadou;;
Generaèná doba bunky je;;
Bunková stena eukaryotickej bunky môe obsahova;;
Kde sa nachádzajú jadrové póry;;
Osobitnı typ bunkového cyklu, ktorım vznikajú pohlavné bunky sa nazıva;;
Bunka priemerne obsahuje;;
Gény v bunke sa môu nachádza;;
Plazmatická membrána buniek je;;
Jeden z dôleitıch metabolickıch procesov v bunke, pri ktorom sa tvoria nové molekuly bielkovín sa nazıva;;
K základnım funkciám bunky patrí;;
Chromozómy môeme nájs;;
V kadej bunke rozlišujeme;;
Ako sa nazıvajú bunky, ktoré sa nekoordinovane delia a ohrozujú celistvos organizmu;;
Ako sa volá proces, pri ktorom sa materská eukaryotická bunka rozdelí na dve rovnocenné dcérske bunky;;
Schopnost' bunky pohlcovat mikroorganizmy sa nazıva;;
Autotrofné bunky môu vyuíva energiu;;
Súhrn regulaènıch procesov v bunke nazıvame;;
Eukaryotickımi bunkami sú tvorené;;
Ribozómy;;
Ktoré vıznamné polysacharidy obsahuje rastlinná bunka;;
Z akej bunky vzniká jedinec pri nepohlavnom rozmnoovaní;;
Kde sa môu nachádza gény v prokaryotickıch bunkách mimo jadra;;
Mitotickı aparát je tvorenı z;;
Fosfolipidy v biomembráne sú usporiadané;;
Syntéza bielkovín prebieha;;
Vyskytujú sa gény eukaryotickıch buniek mimo jadra;;
Základné regulaèné mechanizmy úèinnosti enzımov v bunke sú;;
Cytológia je;;
Somatická hybridizácia buniek: ;;
Ko¾kımi biomembránami je obalené jadro;;
Èo vykonáva funkciu lyzozómov v rastlinnıch bunkách;;
Osmotická lıza bunky je jav;;
Preèo je polopriepustnos plazmatickej membrány pre bunky zásadnou nevyhnutnosou;;
Jadro;;
Syntetickımi centrami buniek sú;;
Keï sa osmotická hodnota prostredia zhoduje s osmotickou hodnotou bunky, je prostredie;;
Glykogén je;;
K replikácii DNA v bunke dochádza v;;
Ako sa nazıva fáza bunkového cyklu, v ktorej prebieha replikácia jadrovej DNA a zdvojenie jadrovıch chromozómov;;
Cytokinéza je;;
Uveïte, ktoré látky sú osmoticky najúèinnejšie;;
Ako sa nazıvajú ohranièené sústavy, v ktorıch prebieha vımena látok, energie a informácií;;
Mitochondrie sú;;
Aké formy endocytózy poznáte;;
Bunky sa môu rozmnoova;;
Všeobecnı mechanizmus vıdaja látok z buniek sa nazıva;;
Medzi látky vstupujúce do bunky vo¾nou difúziou patri;;
Bunka vyuíva osmotickú energiu na;;
Jadierko sa skladá z;;
Bunka sa v meióze rozdelí;;
Ktoré monosacharidy sa vyskytujú v bunke;;
Energia v bunke sa uvo¾òuje;;
Vakuoly môeme nájs;;
Pod¾a štruktúry delíme bunky na;;
Enzymatická sústava oxidatívnej fosforylácie je lokalizovaná v;;
K najdôleitejším mechanizmom, ktorımi sa uskutoèòuje príjem látok do bunky patri;;
Chromatín tvorí;;
Vyskytujú sa v cytoplazme buniek húb plastidy;;
Bunkové organely, ktorıch základom sú biomembrány sa všeobecne nazıvajú;;
Blastoméry sú;;
V anafáze mitózy;;
Bunkovı cyklus je;;
V telofáze mitózy;;
Vısledkom meiotického delenia buniek sú;;
Z buniek ektodermy sa diferencujú;;
Cytoskeletná sústava bunky;;
Predpokladom identity genómov materskej a dcérskych buniek pri bunkovom delení je;;
Hlavnı kontrolnı uzol bunkového cyklu sa nachádza v;;
O chemickom zloení bunkovej steny eukaryotickej bunky platí, e;;
Plazmodezmy sú;;
Ribozómy prokaryotickıch buniek;;
Poèet gonozómov v normálnej somatickej bunke mua aj eny je;;
Eukaryotická bunka sa v mitóze rozdelí;;
Bunka priemerne;;
Fázy bunkové cyklu eukaryotickıch buniek za normálnych okolnosti relatívne v priemere trvajú (ak cely cyklus je 100%);;
Èo sú lyzozómy;;
K bunkovım štruktúram, ktoré nie sú zloené z membrány patria;;
Ribozómy eukaryotickıch buniek;;
Zo sacharidov sa v bunke vyskytujú;;
Pre jednotlivé fázy bunkového cyklu eukaryotickej bunky platí;;
K fázam mitózy nepatri;;
Dusíkové bázy sú v DNA komplementárne v pároch;;
Majú plazmidy schopnos replikova sa samostatne;;
Ako sa volá proces, vzniku dvoch novıch a rovnakıch molekúl DNA, identickıch s pôvodnou molekulou;;
Akı vıznam majú plazmidy z h¾adiska lekárskej praxe;;
Základnou stavebnou jednotkou nukleovıch kyselín je;;
Kedy nastáva zdvojenie molekúl DNA;;
Riadiacim vzorom (matricou) pri syntéze polypeptidového reazca v bunke je molekula;;
Génové ininierstvo sa zaoberá;;
Nositel'om mimojadrovıch génov je;;
Molekulu DNA tvoria;;
Podl'a úseku CAT AAG TAC AAC CGT CAC v DNA vznikne mRNA;;
Biotechnológia;;
Aké typy RNA poznáme;;
Vlastnosti bielkovín, ktoré podmieòujú ich špecifické funkcie v bunke sú dané;;
Èo kódujú gény pre RNA;;
Èo rozumieme pod pojmom expresia štruktúrneho génu;;
K základnım typom génov patria;;
Plazmidy sú;;
Èo je translácia;;
Sekvencia antikodónov tRNA pri syntéze bielkoviny pod¾a pôvodného úseku génu?v DNA CAA AAC TGT GCG TCA TTA CCA je;;
Štruktúrny gén nesie;;
Kodón je;;
Medzi obidvoma polynukleotidovımi reazcami DNA existuje dôleitı vzah nazıvanı;;
Èo je transkripcia;;
Uveïte jednotlivé monosti komplementarity báz tRNA a mRNA;;
Genetická informácia v molekulách DNA je uloená;;
Komplementárne vlákno k úseku reazca ACT GCT TGT GTC AGT AA v DNA je;;
Gény v plazmidoch;;
